<?xml version="1.0"?>
<!DOCTYPE CIRCUITS SYSTEM "Circuit_eSignature.dtd">
<CIRCUITS>
	<CIRCUIT STRUCTURE_RACINE="" DESCRIPTION="Alimentation/Option CET">
		<ETAPE NUMERO="1" DESCRIPTION="Signature de l'agent" TYPESIGNATURE="pdfImageStamp" TOUTESIGNATURE="NON" PIECEJOINTEOBLIGATOIRE="NON" OBLIGATOIRE="OUI">
			<SIGNATAIRE TYPESIGNATAIRE="DEMANDEUR"/>
		</ETAPE>
		<ETAPE NUMERO="2" DESCRIPTION="Visa du responsable" TYPESIGNATURE="visa" TOUTESIGNATURE="NON" PIECEJOINTEOBLIGATOIRE="NON" OBLIGATOIRE="OUI">
			<SIGNATAIRE TYPESIGNATAIRE="RESPONSABLE"/>
		</ETAPE>
		<ETAPE NUMERO="3" DESCRIPTION="Visa du QVT" TYPESIGNATURE="hiddenVisa" TOUTESIGNATURE="NON" PIECEJOINTEOBLIGATOIRE="NON" OBLIGATOIRE="OUI">
			<SIGNATAIRE TYPESIGNATAIRE="AGENT">90786</SIGNATAIRE>
			<SIGNATAIRE TYPESIGNATAIRE="AGENT">94693</SIGNATAIRE>
			<SIGNATAIRE TYPESIGNATAIRE="AGENT">97316</SIGNATAIRE>
		</ETAPE>
		<ETAPE NUMERO="4" DESCRIPTION="Visa du responsable du QVT" TYPESIGNATURE="hiddenVisa" TOUTESIGNATURE="NON" PIECEJOINTEOBLIGATOIRE="NON" OBLIGATOIRE="OUI">
			<SIGNATAIRE TYPESIGNATAIRE="RESPONSABLE_STRUCT">DGEE_4</SIGNATAIRE>
		</ETAPE>
		<ETAPE NUMERO="5" DESCRIPTION="Signature de l'autorite" TYPESIGNATURE="pdfImageStamp" TOUTESIGNATURE="NON" PIECEJOINTEOBLIGATOIRE="NON" OBLIGATOIRE="OUI">
			<SIGNATAIRE TYPESIGNATAIRE="RESPONSABLE_STRUCT">DGE_3</SIGNATAIRE>
			<SIGNATAIRE TYPESIGNATAIRE="RESPONSABLE_STRUCT">DG_2</SIGNATAIRE>
		</ETAPE>
	</CIRCUIT>
</CIRCUITS>